14:52:03.919769 IP 10.5.192.159.52665 > 172.217.197.95.https: Flags [.], ack 506330729, win 4096, length 0
14:52:03.948778 IP 172.217.197.95.https > 10.5.192.159.52665: Flags [.], ack 1, win 244, options [nop,nop,TS val 1777641585 ecr 549067776], length 0
14:52:04.140424 IP 10.5.192.159.62280 > one.one.one.one.domain: 56174+ PTR? 95.197.217.172.in-addr.arpa. (45)
14:52:04.266408 IP one.one.one.one.domain > 10.5.192.159.62280: 56174 ServFail 0/0/0 (45)
14:52:05.699614 IP 172.217.197.189.https > 10.5.192.159.56996: UDP, length 39
14:52:05.707609 IP 10.5.192.159.56996 > 172.217.197.189.https: UDP, length 29
14:52:05.890701 IP 10.5.192.159.52787 > iad23s43-in-f10.1e100.net.https: Flags [.], ack 4121639388, win 4096, length 0
14:52:05.919533 IP iad23s43-in-f10.1e100.net.https > 10.5.192.159.52787: Flags [.], ack 1, win 362, options [nop,nop,TS val 4287343747 ecr 549059850], length 0
14:52:06.210283 IP 10.5.192.159.63109 > one.one.one.one.domain: 26837+ PTR? 1.1.1.1.in-addr.arpa. (38)
14:52:06.228789 IP 172.217.197.189.https > 10.5.192.159.56996: UDP, length 46
14:52:06.228794 IP one.one.one.one.domain > 10.5.192.159.63109: 26837 1/0/0 PTR one.one.one.one. (67)
14:52:06.230296 IP 10.5.192.159.60647 > one.one.one.one.domain: 48582+ PTR? 189.197.217.172.in-addr.arpa. (46)
14:52:06.236781 IP 10.5.192.159.56996 > 172.217.197.189.https: UDP, length 29
14:52:06.328142 IP one.one.one.one.domain > 10.5.192.159.60647: 48582 ServFail 0/0/0 (46)
14:52:07.309230 IP 10.5.192.159.55043 > one.one.one.one.domain: 10658+ PTR? 138.217.58.216.in-addr.arpa. (45)
14:52:07.329306 IP one.one.one.one.domain > 10.5.192.159.55043: 10658 2/0/0 PTR iad23s43-in-f10.1e100.net., PTR iad23s43-in-f138.1e100.net. (115)
14:52:07.388802 IP 10.5.192.159.52674 > ec2-34-195-196-96.compute-1.amazonaws.com.https: Flags [P.], seq 2148621260:2148621323, ack 1041151159, win 4096, options [nop,nop,TS val 549097092 ecr 519997270], length 63
14:52:07.414387 IP ec2-34-195-196-96.compute-1.amazonaws.com.https > 10.5.192.159.52674: Flags [P.], seq 1:64, ack 63, win 8, options [nop,nop,TS val 519999712 ecr 549097092], length 63
14:52:07.414493 IP 10.5.192.159.52674 > ec2-34-195-196-96.compute-1.amazonaws.com.https: Flags [.], ack 64, win 4094, options [nop,nop,TS val 549097117 ecr 519999712], length 0
14:52:07.468158 IP 10.5.192.159.52781 > ec2-34-201-245-158.compute-1.amazonaws.com.https: Flags [P.], seq 1594565451:1594565900, ack 683707594, win 4096, options [nop,nop,TS val 549097170 ecr 3705755512], length 449
14:52:07.468272 IP 10.5.192.159.52781 > ec2-34-201-245-158.compute-1.amazonaws.com.https: Flags [P.], seq 449:554, ack 1, win 4096, options [nop,nop,TS val 549097170 ecr 3705755512], length 105
14:52:07.491808 IP ec2-34-201-245-158.compute-1.amazonaws.com.https > 10.5.192.159.52781: Flags [.], ack 554, win 218, options [nop,nop,TS val 3705763497 ecr 549097170], length 0
14:52:07.492509 IP ec2-34-201-245-158.compute-1.amazonaws.com.https > 10.5.192.159.52781: Flags [.], seq 1:1375, ack 554, win 218, options [nop,nop,TS val 3705763498 ecr 549097170], length 1374
14:52:07.494762 IP ec2-34-201-245-158.compute-1.amazonaws.com.https > 10.5.192.159.52781: Flags [P.], seq 1375:2472, ack 554, win 218, options [nop,nop,TS val 3705763498 ecr 549097170], length 1097
14:52:07.494845 IP 10.5.192.159.52781 > ec2-34-201-245-158.compute-1.amazonaws.com.https: Flags [.], ack 2472, win 4061, options [nop,nop,TS val 549097195 ecr 3705763498], length 0
14:52:08.055186 IP 172.217.197.95.https > 10.5.192.159.52665: Flags [P.], seq 1:41, ack 1, win 244, options [nop,nop,TS val 1777645667 ecr 549067776], length 40
14:52:08.055278 IP 10.5.192.159.52665 > 172.217.197.95.https: Flags [.], ack 41, win 4094, options [nop,nop,TS val 549097753 ecr 1777645667], length 0
14:52:08.226119 IP 172.217.197.189.https > 10.5.192.159.56996: UDP, length 39
14:52:08.234107 IP 10.5.192.159.56996 > 172.217.197.189.https: UDP, length 29

